САРАТОВ,,,,,,,,,,,,,,,,,,,,,,,
ВИНО БЕЛОЕ СУХОЕ,новая цена,Наличие,New,страна,сорт винограда,крепость,,,,,,цена,закуп,,,,,,,,,,Новая цена
"Вино Айси Цинандали белое сухое 0,75 л",1540,,470,Грузия,Ркацители\Мцване Кахури,"12,5",,,,,,1100,400,,,,,,,,,,1270
"Вино Цинандали Алаверди белое сухое 0,75 л",1590,,500,Грузия,Ркацители\Мцване Кахури,"12,5",,,,,,1200,470,,,,,,,,,,1310
"Вино Калмеда Совиньон Блан-Москатель белое сухое 0,75 л",1720,,570,Чили,Совиньон Блан\Москатель,"12,5",,,,,,1600,500,,,,,,,,,,1420
"Вино Куумба Шардоне белое сухое 0,75 л",1770,,600,ЮАР,Уни Блан/Совиньон Блан/Айрен,13,,,,,,1300,400,,,,,,,,,,1470
Вино Бродлиф Совиньон Блан белое сухое,1820,,630,ЮАР,Совиньон Блан,"12,5",,,,,,1500,550,,,,,,,,,,1510
"Вино Оушен Свирл Шардоне белое сухое 0,75 л",1860,,650,ЮАР,Шардоне,"12,5",,,,,,1700,650,,,,,,,,,,1540
"Вино Тенуте Дель Неччио Орвието Классико белое сухое 0,75 л",1950,,700,Италия,"Грекетто, Проканико, Шардоне","12,5",,,,,,1600,620,,,,,,,,,,1620
Вино Пьетраме Пино Гриджо Терре ди Кьети Абруццо IGP белое сухое,2120,,800,Италия,Пино Гриджио,"12,5",,,,,,1600,680,,,,,,,,,,1799
"Вино Универсале белое полусухое 0,75 л",2220,,850,Италия,Грилло\Совиньон\Верментино,"13,5",,,,,,1900,850,,,,,,,,,,1850
"Вино Н Нивариус белое сухое 0,75 л",2310,,900,Испания,Темпранильо Бланко,"13,5",,,,,,1900,900,,,,,,,,,,2220
Вино Маркес Де Касерес Бланко белое сухое 0.75,2440,,970,Испания,Виура/Макабео,12.5,,,,,,2000,950,,,,,,,,,,2199
"Вино Ла Форшетьер Совиньон Блан белое сухое 0,75 л",2820,,1190,Франция,Совиньон Блан,"11,5",,,,,,2000,1190,,,,,,,,,,2380
"Вино Терра Норте ДО Риас Байшас белое сухое 0,75 л",3390,,1500,Испания,Альбариньо,"13,5",,,,,,2500,1500,,,,,,,,,,3000
Вино Трамонтана Сицилия белое сухое,1430,нет,490,Италия,Треббьяно,11,,,,,,1000,300,,,,,,,,,,1299
"Вино Ошторошбор Иршаи Оливер белое сухое 0,75 л",,нет,нет,Венгрия,Иршаи Оливер,11.5,,,,,,1500,500,,,,,,,,,,#VALUE!
Вино Санта Лус Альба Совиньон Блан Центральная долина белое сухое,,нет,нет,Чили,Совиньон Блан,12,,,,,,1600,630,,,,,,,,,,#VALUE!
"Вино Маркези Спинола Гави Биолоджико DOCG белое сухое 0,75 л",,нет,нет,Италия,Кортезе,"12,5",,,,,,2500,1500,,,,,,,,,,#VALUE!
,,,,,,,,,,,,,,,,,,,,,,,
ВИНО БЕЛОЕ ПОЛУСЛАДКОЕ,новая цена,Наличие,New,страна,сорт винограда,крепость,,,,,,цена,закуп,,,,,,,,,,
"Вино Алазанская Долина Алаверди белое полусладкое 0,75 л",1580,,490,Грузия,Ркацители\Кахури Мцване,13,,,,,,1200,400,,,,,,,,,,
"Вино Бадагони Алазанская Долина белое полусладкое 0,75 л",1720,,570,Грузия,Ркацители,"10,5",,,,,,1399,350,,,,,,,,,,
"Вино Энгельшайн Либлих белое полусладкое 0,75 л",1770,,600,Германия,Айрен\Треббьяно\Макабео,"9,5",,,,,,1500,530,,,,,,,,,,
"Вино Пиккола Джойа Мальвазия Рубиконе ИГТ белое полусладкое 0,75 л",1950,,700,Италия,Маливазия,9,,,,,,1500,550,,,,,,,,,,
Вино Лизард Рислинг бел.п/сл,2120,,800,Германия,Рислинг,11,,,,,,1600,540,,,,,,,,,,
"Вино Блэк Бёрд Вестерн Кейп Во белое полусладкое 0,75 л",2160,,820,ЮАР,Шенен Блан,"11,5",,,,,,1600,820,,,,,,,,,,
Вино Маркес Де Касерес Сантинела Риоха DOC белое полусладкое,2490,,1000,Испания,"Мальвазия, Виура/Макабео",11.5,,,,,,1900,1000,,,,,,,,,,
Вино Санта Лус Альба Москато Центральная долина белое полусладкое,,нет,нет,Чили,Москато,12,,,,,,1600,600,,,,,,,,,,
Вино Трамонтана Сицилия белое полусладкое,,нет,490,Италия,Треббьяно,"10,5",,,,,,1000,390,,,,,,,,,,
"Вино Tabla Алазанская Долина белое полусладкое 0,75 л",,нет,нет,Грузия,Ркацители\Цоликоури,"11,5",,,,,,1400,470,,,,,,,,,,
,,,,,,,,,,,,,,,,,,,,,,,
ВИНО БЕЛОЕ ПОЛУСУХОЕ,новая цена,Наличие,New,страна,сорт винограда,крепость,,,,,,цена,закуп,,,,,,,,,,
"Вино Вилла Анна Пино Гриджио белое полусухое 0,75 л",1810,,620,Италия,Пино Гриджио,12,,,,,,1500,570,,,,,,,,,,
"Вино Терра де Оро Шардоне белое полусухое 0,75 л",1890,,670,Чили,Шардоне,13,,,,,,1500,500,,,,,,,,,,
Вино Маре Альта Винью Верде DOC белое полусухое,1930,,690,Португалия,"Аринто/Падерна, Лоурейро",10,,,,,,1600,670,,,,,,,,,,
"Вино Вейнцунфт Рислинг Мозель белое полусухое 0,75 л",2120,,800,Германия,Рислинг,12,,,,,,1700,790,,,,,,,,,,
Вино Лизард Рислинг Трокен белое полусухое,2180,,830,Германия,Рислинг,12,,,,,,1700,830,,,,,,,,,,
"Вино Примо Фиоре Фамозо белое полусухое 0,75 л",2360,,930,Италия,Фамозо,"12,5",,,,,,1900,930,,,,,,,,,,
"Вино Зибенштейн Совиньон Блан Пфальц белое полусухое 0,75 л",2390,,950,Германия,Совиньон Блан,"12,5",,,,,,1900,?,,,,,,,,,,
"Вино Зибенштейн Рислинг Пфальц белое полусухое 0,75 л",2440,,970,Германия,Рислинг,12,,,,,,1900,970,,,,,,,,,,
Вино Макуту Бей Совиньон Блан белое полусухое ,2750,,1150,Новая Зеландия,Совиньон Блан,12,,,,,,2100,1050,,,,,,,,,,
,,,,,,,,,,,,,,,,,,,,,,,
ВИНО РОЗОВОЕ СУХОЕ,новая цена,Наличие,New,страна,сорт винограда,крепость,,,,,,цена,закуп,,,,,,,,,,
"Вино жемчужное Кашу Фрешку розовое сухое 0,75 л",1930,,690,Португалия,Арагонеш\Каштелау,"11,5",,,,,,1600,500,,,,,,,,,,
"Вино Бродлиф Совиньон Блан розовое сухое 0,75 л",1820,,630,ЮАР,Совиньон Блан\Пино Нуар,"12,5",,,,,,1700,550,,,,,,,,,,
"Вино Розато Тоскана Тенуте Россетти розовое сухое 0,75 л",2120,,800,Италия,Санджовезе\Мерло,"12,5",,,,,,1900,800,,,,,,,,,,
"Вино Кампо Вента Дон Хуан Тиерра де Кастилья розовое сухое 0,75 л",,нет в наличии,нет,Испания,Бобаль,12,,,,,,1500,500,,,,,,,,,,
,,,,,,,,,,,,,,,,,,,,,,,
ВИНО РОЗОВОЕ ПОЛУСУХОЕ,новая цена,Наличие,New,страна,сорт винограда,крепость,,,,,,цена,закуп,,,,,,,,,,
"Вино Бриза ду Мар Винью Верде DOC розовое полусухое 0,75 л",1860,,650,Португалия,Виньяу\Амарал\Боррасал,10,,,,,,1600,590,,,,,,,,,,
"Вино Маре Альта Винью Верде розовое полусухое 0,75 л",1930,,690,Португалия,Виньаон\Боррасал\Эшпадейро,10,,,,,,1700,670,,,,,,,,,,
"Вино Галеоне Примитиво Мерло Розе Апулия розовое полусухое 0,75 л",2120,,800,Италия,Примитиво/Мерло,"12,5",,,,,,1900,770,,,,,,,,,,
,,,,,,,,,,,,,,,,,,,,,,,
ВИНО КРАСНОЕ СУХОЕ,новая цена,Наличие,New,страна,сорт винограда,крепость,,,,,,цена,закуп,,,,,,,,,,
"Вино Саперави красное сухое 0,75 л",1180,,270,Россия,Саперави,11,,,,,,1200,250,,,,,,,,,,
"Вино Кинта дель Дуке Виньо Тинто красное сухое 0,75 л",1590,,500,Испания,Темпранильо,11,,,,,,1300,490,,,,,,,,,,
"Вино Сол де Плата Мальбек красное сухое 0,75 л",1860,,650,Аргентина,Мальбек,"13,5",,,,,,1500,650,,,,,,,,,,
"Вино Саперави Бадагони красное сухое 0,75 л",1930,,690,Грузия,Саперави,13,,,,,,1400,590,,,,,,,,,,
"Вино Марселино Риоха красное сухое 0,75 л",1890,,670,Испания,Темпранильо,"13,5",,,,,,1600,650,,,,,,,,,,
"Вино Терраш де Монсараш красное сухое 0,75 л",1860,,650,Португалия,Тринкадейра\Арагонеш\Кастелао,"13,5",,,,,,1700,650,,,,,,,,,,
"Вино Тенуте Дель Неччио Кьянти красное сухое 0,75 л",2120,,800,Италия,"Санджовезе, Мальвазия Нера, Чильеджоло",13,,,,,,1700,700,,,,,,,,,,
"Вино Марселино Риоха Крианза красное сухое 0,75 л",2180,,800,Испания,Темпранильо,"12,5",,,,,,1900,800,,,,,,,,,,
"Вино Ультимо Бастион Бобаль Гарнача Крианца красное сухое 0,75 л",2200,,800,Испания,Бобаль\Гарнача,"12,5",,,,,,1800,770,,,,,,,,,,
"Вино Бариста Пинотаж красное сухое 0,75 л",2220,,850,ЮАР,Пинотаж,13,,,,,,2100,850,,,,,,,,,,
"Вино Марселино Ресерва Риоха ДОКа красное сухое 0,75 л",2250,,870,Испания,Темпранильо,"13,5",,,,,,2000,800,,,,,,,,,,
"Вино Сеньорио Де Ла Ералта Гран Резерва красное сухое 0,75 л",3020,,1300,Испания,Темпранильо,"13,5",,,,,,2300,1300,,,,,,,,,,
Вино Маркес Де Касерес Крианса красное сухое 0.75,3120,,1350,Испания,Темпранильо/Гарнача/Грасиано,14,,,,,,2500,1350,,,,,,,,,,
"Вино Патриа Чика красное сухое 0,75 л",3210,,1400,Испания,Темпранильо\Гарнача\Мерло\Каберне Совиньон,"14,5",,,,,,2500,1400,,,,,,,,,,
Вино Трамонтана Апулия красное сухое,,нет,490,Италия,Санджовезе,11,,,,,,1000,400,,,,,,,,,,
"Вино Мирла Бэй Пино Нуар красное сухое 0,75 л",,нет,нет,Чили,Пино Нуар,"12,5",,,,,,1700,670,,,,,,,,,,
"Вино Тенуте Дель Неччио Кьянти Ризерва красное сухое 0,75 л",,нет,нет,Италия,Санджовезе,"12,5",,,,,,1800,630,,,,,,,,,,
"Вино Бардолино Валлезелле Пьеве Сан Вито красное сухое 0,75 л",,нет,нет,Италия,Корвина\Рондинелла\Молинара\Неграра,13,,,,,,2200,1150,,,,,,,,,,
,,,,,,,,,,,,,,,,,,,,,,,
ВИНО КРАСНОЕ ПОЛУСЛАДКОЕ,новая цена,Наличие,New,страна,сорт винограда,крепость,,,,,,цена,закуп,,,,,,,,,,
"Вино Кахури Гвинис Марани Алазанская Долина белое полусладкое 0,75 л",1510,,450,Грузия,Ркацители,12,,,,,,1300,350,,,,,,,,,,
"Вино Музаради Алазанская Долина белое полусладкое 0,75 л",1580,,490,Грузия,Ркацители\Белые сорта винограда,"12,5",,,,,,1400,400,,,,,,,,,,
"Вино Музаради Киндзмараули красное полусладкое 0,75 л",1600,,490,Грузия,Саперави,11,,,,,,1400,400,,,,,,,,,,
"Вино Блэк Бёрд Вестерн Кейп Во красное полусладкое 0,75 л",1650,,500,ЮАР,Пинотаж,"13,5",,,,,,1500,500,,,,,,,,,,
"Вино Рио Рика Ред Бленд красное полусладкое 0,75 л",1680,,550,Чили,Каберне Совиньон\Карменер\Шираз,"12,5",,,,,,1600,550,,,,,,,,,,
"Вино Мукузани Кахури Гвинис Марани красное сухое 0,75 л",1700,,550,Грузия,Саперави,12,,,,,,1700,450,,,,,,,,,,
"Вино Кахури Киндзмараули красное полусладкое 0,75 л",1750,,590,Грузия,Саперави,12,,,,,,1700,590,,,,,,,,,,
"Вино Киндзмараули Шалвино красное полусладкое 0,75 л",1930,,690,Грузия,Саперави,12,,,,,,1900,630,,,,,,,,,,
"Вино Киндзмараули Бадагони красное полусладкое 0,75 л",2120,,800,Грузия,Саперави,11,,,,,,2000,690,,,,,,,,,,
"Вино Киндзмараули Виниверия красное полусладкое 0,75 л",2670,,1100,Грузия,Саперави,12,,,,,,2100,1000,,,,,,,,,,
"Вино Tabla Киндзмараули красное полусладкое 0,75 л",,нет в наличии,500,Грузия,Саперави,"11,5",,,,,,1500,500,,,,,,,,,,
Вино Трамонтана Апулия красное полусладкое,,нет,490,Италия,Санджовезе,"10,5",,,,,,1000,450,,,,,,,,,,
,,,,,,,,,,,,,,,,,,,,,,,
ВИНО КРАСНОЕ ПОЛУСУХОЕ,новая цена,Наличие,New,страна,сорт винограда,крепость,,,,,,цена,закуп,,,,,,,,,,
"Вино Пиросмани Кахури Гвинис Марани красное полусухое 0,75 л",1510,,450,Грузия,Саперави,"11,5",,,,,,1100,360,,,,,,,,,,
"Вино Фортецца деи Колли Негроамаро красное полусухое 0,75 л",2010,,730,Италия,Негроамаро,13,,,,,,1500,700,,,,,,,,,,
"Вино Пьетраме Монтепульчано Д`Абруццо красное полусухое 0,75 л",2050,,730,Италия,Монтепульчано,13,,,,,,1600,730,,,,,,,,,,
"Вино Бастиони Делла Рокка Аппассименто красное полусухое 0,75 л",2070,,730,Италия,Примитиво\Негроамаро,15,,,,,,1700,730,,,,,,,,,,
"Вино Фортецца Деи Колли Примитиво красное полусухое 0,75 л",2080,,770,Италия,Примитиво,"13,5",,,,,,1500,550,,,,,,,,,,
"Вино Пьетраме Монтепульчано Д`Абруццо Лимитата кр.полусух 0,75 л",2250,,870,Италия,Монтепульчано,13,,,,,,1800,770,,,,,,,,,,
"Вино Виллакьяра Неро Д`Авола Сицилия ДОП красное полусухое 0,75 л",2300,,870,Италия,Неро д'Авола,13,,,,,,1900,870,,,,,,,,,,
"Вино Эпикуро Примитиво красное полусухое 0,75 л",2310,,900,Италия,Примитиво,14,,,,,,1900,850,,,,,,,,,,
"Вино Примо Фиоре Ува Лонганези красное полусухое 0,75 л",2350,,900,Италия,Ува Лонганези,"13,5",,,,,,1900,900,,,,,,,,,,
"Вино Пино Нуар Лесс Зибенштейн красное полусухое 0,75 л",2390,,950,Германия,Пино Нуар,"12,5",,,,,,2000,950,,,,,,,,,,
"Вино Кьянти Ризерва красное полусухое 0,75 л",2490,,1000,Италия,Санджовезе\Мерло,13,,,,,,2000,950,,,,,,,,,,
"Вино Баррелая красное полусухое 0,75 л",2500,,1000,Италия,Мерло\Каберне Совиньон\Сира/Шираз\Санджовезе,"13,5",,,,,,2100,1000,,,,,,,,,,
"Вино Неро ди Тройя красное полусухое 0,75 л",2850,,1200,Италия,Неро ди Троя,15,,,,,,2200,1200,,,,,,,,,,
"Вино Орапьена Монтепульчано д'Абруццо Ризерва красное полусухое 0,75 л",2910,,1230,Италия,Монтепульчано,"13,5",,,,,,2200,1100,,,,,,,,,,
"Вино Сузуманьелло Гран Аппассо красное полусухое 0,75 л",3020,,1300,Италия,Сузуманьелло,"14,5",,,,,,2300,1300,,,,,,,,,,
Вино ВайНот?! IGP красное полусухое,3210,,1400,Италия,Зинфандель,15,,,,,,2500,1400,,,,,,,,,,
"Вино Кот де Сомме Пино Нуар красное полусухое 0,75 л",,нет,нет,Франция,Пино Нуар,14,,,,,,1800,850,,,,,,,,,,
"Вино Спенсер Бэй Пинотаж красное полусухое 0,75 л",,нет,нет,ЮАР,Пинотаж,"13,5",,,,,,1400,550,,,,,,,,,,
"Вино Кальдора Санджовезе Мерло красное полусухое 0,75 л",,нет,нет,Италия,Санджовезе\Мерло,"13,5",,,,,,1500,500,,,,,,,,,,
,,,,,,,,,,,,,,,,,,,,,,,
ПОРТВЕЙН,новая цена,Наличие,New,страна,сорт винограда,крепость,,,,,,,,,,,,,,,,,
"Вино ликерное Портвейн белый Гурзуф Крым крепкое белое 0,75 л",1510,,450,Россия,Кокур\Первенец Магарача\Шардоне\Алиготе\Ркацители\Мускат\Италия\Мускат Янтарный,17,,,,,,,,,,,,,,,,,
"Вино ликерное ПОРТВЕЙН Красный Гурзуф крепкое красное 0,75 л",1550,,450,Россия,Бастардо\Магарачский\Каберне Совиньон\Саперави,17,,,,,,,,,,,,,,,,,
"Вино ликерное Массандра Портвейн Белый Крымский 0,75 л",2040,,750,Россия,Кокур\Ркацители\Алиготе,"17,5",,,,,,,,,,,,,,,,,
"Портвейн Гравураш ду Коа Порто Руби красный сладкий 0,75 л",2490,,1000,Португалия,Турига Франка\Тинта Баррока\Тинта Амарела\Тинта Рориш,19,,,,,,,,,,,,,,,,,
,,,,,,,,,,,,,,,,,,,,,,,
"ВОДКА 0,5л",новая цена,Наличие,New,,,,,,,,,цена,закуп,,,,,,,,,,
"Водка Тундра Аутентик 0,5",1510,,450,,,,,,,,,1000,390,,,,,,,,,,
"Водка Зимняя деревенька на солодовом спирте 0,5",1650,бристоль,530,,,,,,,,,1100,360,,,,,,,,,,
"Водка Медведь 0,5 л",1740,,580,,,,,,,,,,,,,,,,,,,,
"Водка Белая Березка 0,5",1770,,600,,,,,,,,,1100,430,,,,,,,,,,
"Водка Русский Стандарт Голд 0,5",1910,,680,,,,,,,,,1100,440,,,,,,,,,,
"Водка виноградная Найт Габриелло Граппа Нобиле 0,5 л",2490,,1000,,,,,,,,,1800,1000,,,,,,,,,,
"Водка Белуга Нобл 0,5 л",2850,,1200,,,,,,,,,2300,1000,,,,,,,,,,
"Водка Чистые росы 0,5 ",2850,,1200,,,,,,,,,2500,1200,,,,,,,,,,
"Водка ГРЕЙ ГУЗ 0,5Л ",5720,,2800,,,,,,,,,3000,2300,,,,,,,,,,
"Водка Белый чай имбирь 0,5 л",,нет,нет,,,,,,,,,1600,750,,,,,,,,,,
"Водка АБСОЛЮТ 40% 0,5Л ",,нет,нет,,,,,,,,,2500,1500,,,,,,,,,,
,,,,,,,,,,,,,,,,,,,,,,,
"ВОДКА 0,7л",новая цена,Наличие,New,,,,,,,,,цена,закуп,,,,,,,,,,
"Водка Пять Озер 0,7",1650,,530,,,,,,,,,1200,460,,,,,,,,,,
"Водка Зимняя Деревенька на солодовом спирте  0,7",1720,,570,,,,,,,,,1200,490,,,,,,,,,,
"Водка Тундра Аутентик 0,7",1810,,620,,,,,,,,,1200,450,,,,,,,,,,
"Водка Белая Березка  0,7",2120,,800,,,,,,,,,1300,590,,,,,,,,,,
"Водка Русский Стандарт  0,7",2310,,900,,,,,,,,,1400,630,,,,,,,,,,
"Водка Чистые росы 0,7 ",3920,,1800,,,,,,,,,2700,1500,,,,,,,,,,
"Водка Белуга Транслантик 40% 0,7Л",4000,,1800,,,,,,,,,2700,1800,,,,,,,,,,
"Водка Суммум 0,7 л",4460,,2100,,,,,,,,,3100,2100,,,,,,,,,,
"Водка АБСОЛЮТ 40% 0,7Л ",,нет,нет,,,,,,,,,2800,,,,,,,,,,,
,,,,,,,,,,,,,,,,,,,,,,,
ВОДКА 1л,новая цена,Наличие,New,,,,,,,,,цена,закуп,,,,,,,,,,
Водка Зимняя Деревенька на солодовом спирте 1л,2120,бристоль,800,,,,,,,,,1400,580,,,,,,,,,,
Водка Медведь 1 л,2650,,1090,,,,,,,,,1700,900,,,,,,,,,,
Водка Белая Березка 1Л,2670,,1100,,,,,,,,,1500,770,,,,,,,,,,
Водка Русский Стандарт 1л,2850,,1200,,,,,,,,,1600,840,,,,,,,,,,
,,,,,,,,,,,,,,,,,,,,,,,
"ВИСКИ 0,5л",новая цена,Наличие,New,,,,,,,,,цена,закуп,,,,,,,,,,
"Виски Наки Томпсон 3 года купажированный 0,5",2180,,830,,,,,,,,,1400,790,,,,,,,,,,
"Виски Вильям Лоусонс Супер Спайсд купажир. 0,5 л",2490,,1000,,,,,,,,,2100,900,,,,,,,,,,
"Виски Вильям Лоусонс не менее 3 лет купажир. 0,5",2670,,1100,,,,,,,,,1600,900,,,,,,,,,,
"Виски бурбон ДЖИМ БИМ 4 ГОДА БЕЛ. ЭТИК. 40% 0,5Л ",,нет,нет,,,,,,,,,2900,2200,,,,,,,,,,
,,,,,,,,,,,,,,,,,,,,,,,
"ВИСКИ 0,7л",новая цена,Наличие,New,,,,,,,,,цена,закуп,,,,,,,,,,
"Виски купажированный шотландский Нобл Стаг 3 года 0,7 л",2290,,890,,,,,,,,,1500,690,,,,,,,,,,
"Виски Наки Томпсон 3 года купажированный 0,7",2850,,1200,,,,,,,,,1800,890,,,,,,,,,,
"Виски купажированный шотландский Сир Эдвардс 0,7 л",2850,,1200,,,,,,,,,1800,1200,,,,,,,,,,
"Виски Вильям Лоусонс не менее 3 лет купажированный 0,7",3210,,1400,,,,,,,,,1900,940,,,,,,,,,,
"Виски Вильям Лоусонс Супер Спайсд выдержка 3 года 0,7 л",3390,,1500,,,,,,,,,2400,1050,,,,,,,,,,
"Виски Баллантайнс Файнест не менее 3 лет 0,7 л",4280,,2000,,,,,,,,,3200,1600,,,,,,,,,,
"Виски Джонни Уокер Рэд Лейбл не менее 3 лет купажир. 0,7 л",4650,,2200,,,,,,,,,2900,1299,,,,,,,,,,
"Виски Джемесон не менее 3 лет купажир. 0,7",5720,,2800,,,,,,,,,3400,2050,,,,,,,,,,
"Виски бурбон ДЖИМ БИМ 4 ГОДА 40% 0,7Л",6080,,3000,,,,,,,,,3300,1800,,,,,,,,,,
"Виски Джек Дениел`сТеннесси 0,7",6080,,3000,,,,,,,,,3700,2100,,,,,,,,,,
"Виски купажированный ХАТОЗАКИ 3 ГОДА 40% 0,7Л",7880,,4000,,,,,,,,,4000,3299,,,,,,,,,,
"Виски шотландский купажированный ЧИВАС РИГАЛ 12 ЛЕТ П/УП. 0,75Л ",8590,,4400,,,,,,,,,5200,4400,,,,,,,,,,
"Виски шотландский ЧИВАС РИГАЛ 18 ЛЕТ 40% П/УП. 0,7Л ",19730,,10600,,,,,,,,,11500,9100,,,,,,,,,,
"Виски Джонни Блонде 0,7 л",,нет,нет,,,,,,,,,2800,2250,,,,,,,,,,
Виски ирланский Поугс фруктовая мята и лайм (красный) 0.7л,,нет,нет,,,,,,,,,3000,1900,,,,,,,,,,
"Виски шотландский ДЖОННИ УОКЕР ГОЛД ЛЕЙБЛ П/УП. 0,7Л ",,нет,нет,,,,,,,,,11000,6500,,,,,,,,,,
"Виски шотландский МАКАЛЛАН ДАБЛ КАСК 15 ЛЕТ П/УП. 0,7Л",,нет,нет,,,,,,,,,18000,10600,,,,,,,,,,
Виски ирланский Поугс медовый (оранжевый) 0.7л,,нет,2400,,,,,,,,,3200,2400,,,,,,,,,,
"Виски бурбон ДЖИМ БИМ РАЙ ЗЕРНОВОЙ 40% 0,7Л",,нет,3500,,,,,,,,,3700,2200,,,,,,,,,,
"Виски шотландский МАКАЛЛАН ДАБЛ КАСК ГОЛД 3 ГОДА 40% П/УП. 0,7Л",,нет,11000,,,,,,,,,13000,7400,,,,,,,,,,
,,,,,,,,,,,,,,,,,,,,,,,
ВИСКИ 1л,новая цена,Наличие,New,,,,,,,,,цена,закуп,,,,,,,,,,
Виски Джонни Уокер Рэд Лейбл не менее 3 лет 1 л,5010,,2400,,,,,,,,,3300,1299,,,,,,,,,,
Виски (бурбон) Джим Бим 4 года зерновой 1 л,6080,,3000,,,,,,,,,3800,2500,,,,,,,,,,
Виски Теннесси Джек Дениел`с 1 л,7880,,4000,,,,,,,,,3900,3799,,,,,,,,,,
Виски зерновой ДЖЕК ДЭНИЕЛС ТЕННЕССИ 40% 1Л,,нет,нет,,,,,,,,,5000,3500,,,,,,,,,,
,,,,,,,,,,,,,,,,,,,,,,,
"КОНЬЯК 0,5л",новая цена,Наличие,New,,,,,,,,,цена,закуп,,,,,,,,,,
"Коньяк ординарный Армянский Коньяк 5 лет 0,5 л",1880,,660,,,,,,,,,1200,560,,,,,,,,,,
