Новосибирск,,,,,,,,,,,,,
"Коньяк Реми Мартан ВСОП 4 года п/к 0,7 л",,нет,7700,,,,,,,,,8500,7700
"Коньяк Курвуазье Фонтенебло 3 года п/к 0,7 л",,нет,4000,,,,,,,,,7800,4000
"Коньяк ординарный ХЕННЕССИ ВС 40% П/УП. 0,7Л",,нет,нет,,,,,,,,,6300,5500
,,,,,,,,,,,,,
"РОМ 0,5л",новая цена,Наличие,New,,,,,,,,,цена,закуп
"Ром Капитан Жан Лафитт дарк 0,5 л",1780,,550,,,,,,,,,,
"Напиток спиртной на основе рома Оакхарт Ориджинал Бакарди 0,5",2430,,900,,,,,,,,,1700,850
,,,,,,,,,,,,,
"РОМ 0,7л",новая цена,Наличие,New,,,,,,,,,цена,закуп
"Ром Мама Джама Блэк выдержанный 0,7 л",2030,,690,,,,,,,,,,
"Спиртной напиток ромовый КУЛ СКЕЛЕТОН КОКОС 37,5% 0,7Л",2060,"кб,бристоль",700,,,,,,,,,,
"Спиртной напиток ромовый КУЛ СКЕЛЕТОН МАНГО МАРАКУЙЯ 37,5% 0,7Л",2060,"кб,бристоль",700,,,,,,,,,,
"Набор Оакхарт Ориджинал Спайс Голд+2 банки Rich Cola 0,7 л",2610,"кб,бристоль",1000,,,,,,,,,2799,1970
"Ром Блэк Пирл Уайт 0,7 л",2610,"кб,бристоль",1000,,,,,,,,,1900,1150
"Ром Блэк Пирл Дарк 0,7 л",2710,"кб,бристоль",1050,,,,,,,,,1900,1000
"Напиток спиртной на основе рома Оакхарт Ориджинал Бакарди 0,7",2990,,1200,,,,,,,,,1900,1050
"Напиток спиртной на осн. рома КАПИТАН МОРГАН ПРЯНЫЙ ЗОЛОТОЙ 35% 0,7Л",2990,,1200,,,,,,,,,2500,1200
"Ром выдержанный Сангсом в п/к 0,7 л",3170,,1300,,,,,,,,,,
"Ром Барсело Аньехо 0,7Л",3650,,1550,,,,,,,,,2600,1550
"Ром Matusalem Solera 7 лет, 0.7л",4860,"кб, метро",2200,,,,,,,,,,
Контрабандо 5 лет 0.7л,5040,,2300,,,,,,,,,3799,1670
"Ром Бругал Аньехо Супериор 0,7 л",4820,нет,2300,,,,,,,,,3900,2500
Ром Барсело Аньехо Гран 0.7л,3560,нет,1600,,,,,,,,,2500,1500
"Ром выдержанный Гавана Клаб Аньехо 3 года белый 0,7 л",5550,нет,2700,,,,,,,,,3100,2300
"Ром Закапа XO п/к 0,7 л",20450,нет,11000,,,,,,,,,11500,10500
"Ром выдержанный БАРСЕЛО ДОРАДО 37,5-40% 0,7Л",,нет,нет,,,,,,,,,2500,1150
,,,,,,,,,,,,,
ТЕКИЛА,новая цена,Наличие,New,,,,,,,,,цена,закуп
"Спиртной напиток ДЭД МЭН'С ФИНГЕРС ТЕКИЛА РЕПОСАДО 40% 0,7Л",3920,бристоль,1700,,,,,,,,,2700,1700
"Текила Хосе Куэрво золотая 0,7 л",5600,,2600,,,,,,,,,3400,2500
"Текила Эсполон Бланко 0,75 л",6350,,3000,,,,,,,,,3500,2650
"Текила Эсполон Репосадо 0,75 л",6350,,3000,,,,,,,,,3700,2700
"Спиртной напиток ТЕКИЛА АСИЕНДА ВЬЕХА РЕПОСАДО 40% 0,75Л",,нет,3000,,,,,,,,,4000,2900
"Спиртной напиток ТЕКИЛА АСИЕНДА ВЬЕХА БЛАНКО 40% 0,75Л",,нет,3000,,,,,,,,,4000,2900
"Текила Ла Тременда 0,7 л",,нет,нет,,,,,,,,,2000,1100
"Текила Пелигро Катрина Сильвер 0,7 л",,нет,нет,,,,,,,,,2500,1000
,,,,,,,,,,,,,
ДЖИН,новая цена,Наличие,New,,,,,,,,,цена,закуп
"Джин БРИСТОЛЛС 40% 0,5Л",2060,бристоль,700,,,,,,,,,1400,590
"Джин БРИСТОЛЛС 40% 0,7Л",2150,бристоль,750,,,,,,,,,1600,730
"Джин Гордонс лондонский сухой 0,7",4300,?,1900,,,,,,,,,2700,1900
"Спиртной напиток на основе джина ГОРДОНС ПИНК 37,5% 0,7Л",5790,"?, бристоль",2700,,,,,,,,,2900,1650
"Джин ПИКИ БЛАЙНДЕР СПАЙС ДРАЙ 40% 0,7Л",,нет,нет,,,,,,,,,1800,900
"Джин Бифитер Лондон Драй 0,7",,нет,нет,,,,,,,,,3500,2500
"Джин Хендрикс 0,7л  ",,нет,нет,,,,,,,,,5000,4000
"Джин Року 0,7л  ",,нет,нет,,,,,,,,,4800,3800
,,,,,,,,,,,,,
ЛИКЕР,новая цена,Наличие,New,,,,,,,,,цена,закуп
"Ликер десертный Ягермайстер 0,7",3920,,1700,,,,,,,,,3000,1600
"Напиток спирт. Апероль (аперитив) 0,75 л",4110,,1800,,,,,,,,,2800,1500
"Ликер Куантро крепкий 0,7 л",4300,,1900,,,,,,,,,2900,1850
"Ликер десертный Кампари (аперитив) 0,75 л",4480,,2000,,,,,,,,,2900,1780
"Ликер эмульсионный Бэйлис сливочный оригинальный 0,7",5140,,2350,,,,,,,,,3000,2350
"Спиртной напиток ДЖЕК ДЭНИЕЛС ТЕННЕССИ ХАНИ ЛИКЕР 35% 0,7Л",5600,бристоль,2600,,,,,,,,,3100,2300
"Ликер десертный Бехеровка 0,7",,нет,нет,,,,,,,,,2700,1450
"Ликер крепкий Самбука Экстра 0,5",,нет,нет,,,,,,,,,1600,550
"Ликер десертный ЛОРЕНЦО ГАСПАРИНИ ЛИМОНЧЕЛЛО 30% 0,5Л",,нет,нет,,,,,,,,,1600,490
Напиток спирт. Апероль (аперитив) 1л,,нет,нет,,,,,,,,,3100,2360
,,,,,,,,,,,,,
"ПРОСЕККО, БРЮТ",новая цена,Наличие,New,страна,сорт винограда,крепость,,,,,,цена,закуп
"Вино игристое Российское Премиум белое брют 0,75 л",1200,,240,Россия,Белые сорта винограда,11,,,,,,1100,240
Вино игристое Шато Тамань РОЗОВОЕ брют 0.75,1440,,370,Россия,Пино Блан/Мюллер/Мускат/Саперави,"12,5",,,,,,1200,320
"Вино игристое Российское Фанагория защ.геогр.ук.белое брют 0,75 л",1670,,490,Россия,Шардоне/Алиготе/Пино Нуар/Рислинг,12,,,,,,1300,450
"Вино игристое ВёВ Албан белое брют 0,75 л",1960,,650,Франция,Айрен,11,,,,,,1600,550
"Вино игристое Вёв Албан розовое брют 0,75 л",2060,,700,Россия,Айрен,"11,5",,,,,,1600,600
"Вино игристое Проссимо спуманте белое брют 0,75 л",2230,,790,Италия,Гарганега,11,,,,,,1700,630
"Вино игристое Кава Арте Латино розовое брют 0,75 л",2240,,800,Испания,Трепат\Пино Нуар,"11,5",,,,,,1700,750
"Вино игристое Корте дей Рови Просекко Экстра Драй DOC белое сухое 0,75 л",3100,,1260,Италия,Глера/Просекко,11,,,,,,1900,1260
"Вино игристое Креман де Луар Домен д`Аврийе белое брют 0,75 л",3170,,1300,Франция,Шардоне\Пино Нуар\Шенен Блан,11,,,,,,3000,1300
Вино игристое Мартини Брют бел.брют,3170,,1300,Италия,"Треббьяно, Шардоне","11,5",,,,,,2100,1200
Игристое вино Просекко Мартини белое сухое,3550,,1500,Италия,Глера/Просекко,"11,5",,,,,,2100,1190
Вино игристое Мондоро Просекко защ.геогр.ук.бел.сух,3920,,1700,Италия,Глера/Просекко,11,,,,,,2300,1380
"Вино игристое Кюве ДиПи Традишн Давид Порэ белое брют 0,75 л",5420,,2500,Франция,Шардоне/Пино Нуар/Пино Менье,"12,5",,,,,,3900,2500
"Вино игристое Шампань Де Корветте Премье Крю белое брют 0,75 л",10080,,5000,Франция,Шардоне/Пино Нуар/Пино Менье,"12,5",,,,,,7200,4700
"Вино игристое выдержанное Моэт и Шандон Империаль белое брют 0,75 л",12580,,6340,Франция,Шардоне/Пино Нуар/Пино Менье,12,,,,,,9500,5900
"Вино игристое Вальпьяна Миллезимато Экстра Драй белое брют 0,75 л",,нет,нет,Италия,Глера,11,,,,,,1600,400
"Вино игристое выдержанное Дж.Г. Мумм Гранд Кордон Брют белое п/к 0,75 л",,нет,нет,Франция,Шардоне/Пино Нуар/Пино Менье,12,,,,,,5000,3000
,,,,,,,,,,,,,
АСТИ,новая цена,Наличие,New,страна,сорт винограда,крепость,,,,,,цена,закуп
"Вино игристое Российское Премиум белое полусладкое 0,75 л",1200,,240,Россия,Белые сорта винограда,12,,,,,,1100,240
"Вино игристое Советское Шампанское белое полусладкое 0,75 л",1300,,300,Россия,Шардоне/Совиньон Блан/Алиготе/Рислинг/Кокур,11,,,,,,1100,280
"Вино игристое Массимо Висконти Ламбруско белое сладкое 0,75 л",1880,,600,Италия,Ламбруско,"7,5",,,,,,1500,500
"Вино игристое Исси Мальвазия Спуманте белое сладкое 0,75 л",2570,,970,Италия,Мальвазия/Мускат,7,,,,,,1800,950
Вино игристое Сант Орсола Асти DOCG белое сладкое,2610,,1000,Италия,Мускат,7,,,,,,1800,880
"Вино игристое Атто Примо Асти белое сладкое 0,75 л",2610,,1000,Италия,Мускат,"7,5",,,,,,1900,990
Вино игристое Чинзано Асти DOCG бел.сл,3370,,1400,Италия,Мускат,7,,,,,,2000,1190
Игристое вино Мартини Асти Пьемонт бел.сл,3550,,1500,Италия,Мускат,"7,5",,,,,,2100,1290
Вино игристое Мондоро Асти DOCG бел.сл,3920,,1700,Италия,Мускат,"7,5",,,,,,2300,1470
Напиток винный газ. Ламбруско Розато п/сл 0.75,,нет,нет,Россия,,8,,,,,,1000,200
Напиток винный газ. Ламбруско Бьянко п/сл 0.75,,нет,нет,Россия,,8,,,,,,1000,250
"Вино игристое Линда Донна Асти DOCG белое сладкое 0,75 л",,нет,нет,Италия,Мускат,"7,5",,,,,,1700,нет в наличии
"Вино игристое Фальдео Асти DOCG белое сладкое 0,75 л",,нет,нет,Италия,Мускат,7,,,,,,1700,нет в наличии
,,,,,,,,,,,,,
ВЕРМУТ,новая цена,Наличие,New,,,,,,,,,цена,закуп
Вермут Чеаро Бьянко 1 л,1550,,430,,,,,,,,,1200,350
"Вермут Каза Позитано Бьянко белый сладкий 0,75 л",2060,мало,700,,,,,,,,,1400,750
"Вермут Чинзано Бьянко белый сладкий 0,5 л",2430,,900,,,,,,,,,1600,850
"Вермут Мартини Бьянко белый сладкий 0,5 л",2610,,1000,,,,,,,,,1600,1000
"Вермут Мартини Экстра Драй белый сухой 0,75 л",2810,,1100,,,,,,,,,1900,1100
"Вермут Мартини Бьянко белый сладкий 0,75 л",2810,,1100,,,,,,,,,1900,1100
"Вермут Мартини Фиеро сладкий 0,75 л",2810,,1100,,,,,,,,,1900,1100
,,,,,,,,,,,,,
ПИВО,новая цена,Наличие,New,,,,,,,,,цена,закуп
"Пиво Жигули Барное светлое ст 0,31 л",199,,57,,,,,,,,,,
"пиво Рижское светлое ст 0,45 л",199,,55,,,,,,,,,,
"Пиво Белорусское светлое фильтрованное пастеризованное ст 0,5 л",199,,67,,,,,,,,,,
"Сидр Мистер Лис Яблоко ж/б 0,43 л",209,,64,,,,,,,,,,
"Пиво БАЛТИКА КЛАССИЧЕСКОЕ №3 СВЕТЛ. ФИЛЬТР. ПАСТЕР. СТ/Б 0,5Л",209,,64,,,,,,,,,,
"Пиво КРУШОВИЦЕ СВЕТЛ. ФИЛЬТР. ПАСТЕР. Ж/Б 0,43Л",219,,70,,,,,,,,,,
"Пиво СТАРЫЙ МЕЛЬНИК ИЗ БОЧОНКА МЯГКОЕ СВЕТЛ. ФИЛЬТР. ПАСТЕР. СТ/Б 0,45Л",229,,70,,,,,,,,,,
"Пивной напиток СТАРЫЙ МЕЛЬНИК ИЗ БОЧОНКА БАРХАТНОЕ ТЕМН. ФИЛЬТР. ПАСТЕР. СТ/Б 0,45Л",229,,70,,,,,,,,,,
"Пиво LOWENBRAU ОРИГИНАЛЬНОЕ СВЕТЛ. ФИЛЬТР. ПАСТЕР. Ж/Б 0,45Л",229,,68,,,,,,,,,,
"Пивной напиток KRONE BLANCHE BIERE СВЕТЛ. НЕФИЛЬТР. ПАСТЕР. СТ/Б 0,45Л",239,,90,,,,,,,,,,
"Сидр Бон Сезон ст 0,4 л",239,,90,,,,,,,,,,
Козел светлое/темное,239,,80,,,,,,,,,200,80
Хугарден,249,,80,,,,,,,,,200,80
жигулевское,249,,50,,,,,,,,,150,50
"Эсса(Дыня-клубника,Кокос-манго,Ананас-грейпфрут)",249,,70,,,,,,,,,250,70
"Пиво Fiery Shield светлое фильтрованное ст 0,33 л (АНАЛОГ КОРОНЫ)",279,,95,,,,,,,,,200,95
шпатен ,339,перекресток\лента,115,,,,,,,,,300,110
корона (перекресток\лента),419,,140,,,,,,,,,350,140
"Пиво Хубер Вайссес Хеллес Хефе Вайссбир светлое нефильтрованное пастеризованное ст 0,5 л",625,,250,,,,,,,,,,
Пиво Bud 0.5 л (стяжка 4шт),999,,340,,,,,,,,,799,75
"Пиво Стелла Артуа светлое ст 0,44 л (стяжка 4шт)",1199,Кб/лента,430,,,,,,,,,999,78
"Пиво Евротур Шварц темное фильтрованное пастеризованное ж/б 0,5 л",нет,нет,80,,,,,,,,,200,80
"Пиво Белджиан Крон Лагер светлое ж/б 0,5 л",нет,нет,90,,,,,,,,,250,90
чешское,нет,нет,90,,,,,,,,,200,90
"Пиво Хоп Райдер Уит Пэйл Эль светлое ж/б 0,33 л",нет,нет,80,,,,,,,,,150,80
"Пиво Хоп Райдер Экстра Стаут темное ж/б 0,33 л",нет,нет,80,,,,,,,,,150,80
"Пиво Хопфендорф Шварцбир темное фильтрованное ж/б 0,5 л",нет,нет,80,,,,,,,,,200,80
"Пиво Хопфендорф Шварцбир темное ж/б 0,5 л",нет,нет,80,,,,,,,,,200,80
,,,,,,,,,,,,,
ПИВО 1л и больше,новая цена,Наличие,New,,,,,,,,,цена,закуп
"Пиво СТАРЫЙ МЕЛЬНИК ИЗ БОЧОНКА МЯГКОЕ СВ.ФИ. 0,9л",299,,109,,,,,,,,,250,
"Пиво ЖИГУЛЕВСКОЕ ТРАДИЦИОННОЕСВЕТЛ. ФИЛЬТР. 1,2Л",299,,110,,,,,,,,,250,
"Пиво Рижское светлое ПЭТ 1,3 л",329,,120,,,,,,,,,200,
Разливное светлое фильтрованное 1л,449,,120,,,,,,,,,450,120
Разливное светлое нефильтрованное 1л,449,,120,,,,,,,,,450,120
Разливое темное 1л,499,,110,,,,,,,,,500,110
"Пиво БЕЛЫЙ МЕДВЕДЬ СВЕТЛ. ФИЛЬТР. ПАСТЕР. ПЭТ 1,15Л",419,,140,,,,,,,,,300,
"Пиво Австрийское светлое ПЭТ 1,5 л",449,,150,,,,,,,,,300,
"Пиво Живая Варка светлое ПЭТ 1,5 л",449,,150,,,,,,,,,300,
"Пиво CARLSBERG СВЕТЛ. ФИЛЬТР. ПАСТЕР. ПЭТ 1,35Л",459,,150,,,,,,,,,300,
"Пиво Пшеничное мягкое ПЭТ 1,5 л",469,,150,,,,,,,,,300,
"Пиво TUBORG GREEN СВЕТЛ. ФИЛЬТР. ПАСТЕР. ПЭТ 1,35Л",479,,170,,,,,,,,,350,
"Пиво ГЁССЕР СВЕТЛ. ФИЛЬТР. ПАСТЕР. ПЭТ 1,2Л",489,,180,,,,,,,,,300,
"Пиво Nord Land Beer светлое крепкое фильтрованное 1,2 л",,нет,нет,,,,,,,,,250,
,,,,,,,,,,,,,
НАПИТКИ Б\А,новая цена,наличие,закуп,,,,,,,,,,
Вода Аква Минерале газированная 2 л,169,,70,,,,,,,,,,
Вода Аква Минерале негаз 2 л,169,,70,,,,,,,,,,
"Минеральная вода Заветный родник негазированная 1,5 л",149,,50,,,,,,,,,,
"Вода Аква Люкс газ 1,5 л",149,,50,,,,,,,,,,
Вода минеральная Аш Тау Скважина 6К газированная 1 л,99,,35,,,,,,,,,,
Напиток ДОБРЫЙ КОЛА ГАЗ.  1Л,299,,100,,,,,,,,,,
Сок RICH ВИШНЯ 1Л,389,,180,,,,,,,,,,
Сок RICH ТОМАТ 1Л,349,,160,,,,,,,,,,
Сок RICH АПЕЛЬСИН\АНАНАС\ГРЕЙПФРУТ 1Л,399,,190,,,,,,,,,,
Сок Сады Придонья томатный с солью с мякотью\яблоко 1 л,339,,150,,,,,,,,,,
"Напиток НАТАХТАРИ ГРУША\ФЕЙХОА\САПЕРАВИ СТ/Б 0,5Л",299,,108,,,,,,,,,,
"Напиток LIPTON ЗЕЛЕНЫЙ ЧАЙ\ЧЕРНЫЙ ЛИМОН НЕГАЗ. 0,5л",249,,90,,,,,,,,,,
Напиток Рич индиан тоник\биттер лимон сильногазированный 1 л,319,,135,,,,,,,,,,
Газированный напиток Эвервесс Биттер Лимон 1 л,239,,80,,,,,,,,,,
"Газированный напиток Старые Добрые Традиции Лимонад ст 0,5 л",159,,40,,,,,,,,,,
"Квас Добрый хлеб фильтрованный пастеризованный 1,5 л",169,,50,,,,,,,,,,
"Чай IceTea Лимон\лесные ягоды\малина 0,5 л",139,,50,,,,,,,,,,
"Минеральная вода Ессентуки Целебная газированная ст 0,5 л",129,,40,,,,,,,,,,
"Нектар Сады Придонья мультифрутовый\яблоко\черешня 0,95 л",399,,209,,,,,,,,,,
Газированный напиток Экспорт Стаил Классик Кола 2 л,299,,100,,,,,,,,,,
,,,,,,,,,,,,,
СИГАРЕТЫ И СТИКИ (за пачку),новая цена,Наличие,New,,,,,,,,,цена,закуп
Сигареты LUCKY STRIKE Green,399,,159,,,,,,,,,350,159
Сигареты Ротманс Грин,399,,159,,,,,,,,,350,159
Сигареты Ротманс Дэми Классик,419,,170,,,,,,,,,350,170
Сигареты Камелл Желтый,449,,180,,,,,,,,,400,180
Сигареты Камелл Компакт,449,,180,,,,,,,,,350,180
Сигареты LUCKY STRIKE XL,469,,190,,,,,,,,,350,190
Стики NEO Ванилла\Тобакко\Тропик,469,,190,,,,,,,,,450,190
Стики IQOS Heets Янтарные\Бронзовые\Голд\Грин\Фиол.\Слайт\Самер Бриз,499,,200,,,,,,,,,450,200
Сигареты Винстон Вайт,499,,200,,,,,,,,,400,200
Сигареты Винстон ИксСтайл,499,,202,,,,,,,,,400,202
Сигареты Винстон xs blue Тонкие,509,,223,,,,,,,,,450,223
Сигареты Винстон XS компакт блю,539,,230,,,,,,,,,400,230
Сигареты Винстон Рэд,539,,230,,,,,,,,,450,230
Сигареты Винстон Блю,539,,230,,,,,,,,,400,230
Сигареты Парламент Платинум Блю,539,,230,,,,,,,,,450,230
Сигареты Винстон Сильвер,539,,233,,,,,,,,,400,233
Сигареты Винстон Классик,549,,240,,,,,,,,,400,240
Сигареты Парламент аква блю,559,,279,,,,,,,,,500,279
Сигареты Парламент сильвер блю,619,,279,,,,,,,,,500,279
Сигареты Парламент One,629,,279,,,,,,,,,500,279
,,,,,,,,,,,,,
ЭЛЕКТРОНКИ,новая цена,Наличие,New,,,,,,,,,цена,закуп
бристоль или любой продуктовый/вейпшоп,,,,,,,,,,,,,
Электронная одноразовая система от 2000тяг,3599,,1900,,,,,,,,,1900,
"(дыня, кола, банан, ягодный микс, клубничный коктейль,",,,,,,,,,,,,,
"гуава-маракуйа, малина-арбуз, яблоко, мармелад, манго",,,,,,,,,,,,,
Электронная одноразовая система от 5000тяг,4199,,2500,,,,,,,,,2900,
"(банан, ягодный микс, клубника,маракуйа,яблоко,манго)",,,,,,,,,,,,,
,,,,,,,,,,,,,
,,,,,,,,,,,,,
СНЭКИ И ДР,новая цена,Наличие,New,,,,,,,,,цена,закуп
ЛУКОВЫЕ КОЛЬЦА СМЕТАНА\СЫР 45г,109,,40,,,,,,,,,100,
Сухарики КИРИЕШКИ ЧИЗБУРГЕР\ОГУРЦЫ\ШАШЛЫК\,119,,50,,,,,,,,,100,
ХОЛОДЕЦ С ХРЕНОМ\ВЕТЧИНА СЫР\СТЕЙК\СЕМГА\ 60г,,,,,,,,,,,,,
Сухарики ХРУСTEAM ЧИАБАТТА ОЛИВКИ\ВЕТЧИНА\,199,,50,,,,,,,,,200,
КРАБ\ТОМАТ\СЫРНОЕ АССОРТИ\СМЕТАНА ЗЕЛЕНЬ 60г ,,,,,,,,,,,,,
Семечки ОТ МАРТИНА ЖАРЕНЫЕ МОРСКАЯ СОЛЬ 100Г,229,,70,,,,,,,,,150,
Чипсы Лэйс Бекон\Краб\Лук/Сменана зелень 90г,249,,100,,,,,,,,,250,
Чипсы Лэйс Бекон\Краб\Лук/Сменана зелень 140г,349,,100,,,,,,,,,350,
Фисташки «ОТЕЦ ОРЕХ» ЖАРЕНЫЕ СОЛЕНЫЕ,449,,220,,,,,,,,,400,
Миндаль «ОТЕЦ ОРЕХ» ЖАРЕНЫЙ 150Г,479,,250,,,,,,,,,350,
Фундук «ОТЕЦ ОРЕХ» ЖАРЕНЫЙ 150Г,489,,260,,,,,,,,,350,
Чипсы соломкой POMSTICKS С СОЛЬЮ\СМЕТАНА 100Г,349,нет,110,,,,,,,,,250,
,,,,,,,,,,,,,
"МЯСО, РЫбА И СЫР КОПЧЕНОЕ\НАРЕЗНОЕ",новая цена,Наличие,New,,,,,,,,,цена,закуп
Колбаса Микоян сырокопченая 80г,149,,60,,,,,,,,,150,60
Крабовые палочки 200г,239,,90,,,,,,,,,200,90
Сыр копченый косичка 90г,299,,100,,,,,,,,,300,100
Сервелат 300г,349,,130,,,,,,,,,350,130
Рыба Копченная ПОРТ АРТУР Желтый полосатик\,359,,140,,,,,,,,,300,140
Кольца кальмара\Мясо кальмара сушено-вяленое\ ,369,,150,,,,,,,,,,150
Кальмар сушеный\Стружка минтая\ 60г,369,,150,,,,,,,,,,150
Сыр плавленый HOCHLAND\PRESIDENT 150г,379,,150,,,,,,,,,350,150
Сосиски МОЛОЧНЫЕ 290Г,399,,170,,,,,,,,,300,170
Филе сельди\горбуша/скумбрия 200г,439,,200,,,,,,,,,250,200
Сыр в ассортименте 180г,799,,200,,,,,,,,,800,200
,,,,,,,,,,,,,
ШОКОЛАД И КОНФЕТЫ,цена,наличие,закуп,,,,,,,,,,
Набор конфет RAFFAELLO 150Г коробка,800,,350,,,,,,,,,,
Набор конфет Ферреро Роше 125г коробка,800,,350,,,,,,,,,,
"Шоколад Чоко энд Натс молочный с цельным фундуком\с миндалем\белый с цельным фундуком, 200г",600,,259,,,,,,,,,,
"Набор конфет Мерси ассорти, 250 г коробка",800,,350,,,,,,,,,,
"Набор конфет Тоффифе, 125 г коробка",600,,,,,,,,,,,,
Шоколад Милка молочный с карамелью\молочный\ с фундуком\миндаль и лесные ягоды 90г,200,,85,,,,,,,,,,
"Набор конфет ОРЕШКА с цельным фундуком со вкусом сливок, 150 г",500,,120,,,,,,,,,,
"Набор конфет Дав Promises ассорти, 118г, коробка",750,,300,,,,,,,,,,
"Набор конфет Родные Просторы с вафельной крошкой, 180 г",450,,160,,,,,,,,,,
"Шоколад Милка Мммакс Арахис и Карамель, 270 г",850,,400,,,,,,,,,,
"Конфеты А.Коркунов Шоколадная палитра, 143 г коробка",600,,250,,,,,,,,,,
Шоколад Альпен Гольд молочный\молочный Орео\с фундуком\ с черникой и йогуртом 80 г,180,,70,,,,,,,,,,