САРАТОВ,,,,,,,,,,,,,,,,,,,,,,,
"Коньяк Фанагория 5 лет 0,5 л",2040,,750,,,,,,,,,1300,610,,,,,,,,,,
"Коньяк Старый Кенигсберг 3 года 0,5 л",2120,,800,,,,,,,,,1500,640,,,,,,,,,,
"Коньяк Армянский Кочари 7 лет подарочный п/к 0,5",2180,,830,,,,,,,,,1600,740,,,,,,,,,,
"Коньяк Фазерс Олд Баррель не менее 5 лет 0,5 л",2210,бристоль,840,,,,,,,,,1400,600,,,,,,,,,,
"Коньяк Грузинский Старый Кахети 5 лет 0,5 л",2220,,850,,,,,,,,,1600,850,,,,,,,,,,
"Коньяк Старейшина 5 лет 0,5",2310,,900,,,,,,,,,1500,740,,,,,,,,,,
"Коньяк Ной Традиционный 5 лет 0,5",2490,,1000,,,,,,,,,1700,850,,,,,,,,,,
Коньяк Старейшина 7 лет 0.5,2490,,1000,,,,,,,,,1800,770,,,,,,,,,,
"Коньяк Армянский Арарат 5 лет п/к 0,5",3020,,1300,,,,,,,,,1900,1200,,,,,,,,,,
Бренди Торрес 10 лет Гран Резерва 0.5 ,3210,,1400,,,,,,,,,2200,1100,,,,,,,,,,
"Бренди Делор Фрер V.S. 0,5 л",5360,,2600,,,,,,,,,2600,1100,,,,,,,,,,
"Коньяк МАРТЕЛЬ ЭЙДЖД ИН РЕД БАРРЕЛС ВСОП 4 ГОДА 40% 0,5Л",7880,очень мало,4000,,,,,,,,,5600,?,,,,,,,,,,
Коньяк А.де Фуссиньи ХО п/к 0.5,15060,,8000,,,,,,,,,7800,7000,,,,,,,,,,
,,,,,,,,,,,,,,,,,,,,,,,
"КОНЬЯК 0,7л",новая цена,Наличие,New,,,,,,,,,цена,закуп,,,,,,,,,,
"Бренди Семболь Националь ХО 0,7 л",4110,,1900,,,,,,,,,2800,1800,,,,,,,,,,
"Кальвадос Дюк Де Норманди ВС п/к 0,7 л",4650,,2200,,,,,,,,,3000,2200,,,,,,,,,,
"Бренди Делор Фрер V.S.O.P. п/к 0,7 л",5550,,2700,,,,,,,,,3800,2700,,,,,,,,,,
"Бренди Делор Фрер X.O. п/к 0,7 л",8420,,4300,,,,,,,,,5200,2800,,,,,,,,,,
"Коньяк Готье ВСОП п/к 0,7 л",8780,,4500,,,,,,,,,5200,4500,,,,,,,,,,
"Коньяк КУРВУАЗЬЕ ВС 3 ГОДА 40% П/УП. 0,7Л",9130,,4700,,,,,,,,,6500,4000,,,,,,,,,,
"Коньяк Хеннесси XO п/к 0,7 л",42010,,23000,,,,,,,,,26000,23000,,,,,,,,,,
"Коньяк КУРВУАЗЬЕ ХО 40% П/УП. 0,7Л",40210,,22000,,,,,,,,,24000,22000,,,,,,,,,,
"Коньяк КУРВУАЗЬЕ ФОНТЕНБЛО КАСКС 3 ГОДА 40% П/УП. 0,7Л",,нет,нет,,,,,,,,,6400,4000,,,,,,,,,,
"Коньяк Хеннеси ВСОП 0,7Л",,нет,9000,,,,,,,,,11000,8900,,,,,,,,,,
Коньяк Реми Мартан ХО 0.7л,,нет,20000,,,,,,,,,25000,20000,,,,,,,,,,
"Коньяк Реми Мартан ВСОП 4 года 40% П/УП. 0,7Л",,нет,нет,,,,,,,,,8500,6500,,,,,,,,,,
,,,,,,,,,,,,,,,,,,,,,,,
"РОМ 0,5л",новая цена,Наличие,New,,,,,,,,,цена,закуп,,,,,,,,,,
"Ром Капитан Жан Лафитт дарк 0,5 л",1590,,500,,,,,,,,,,,,,,,,,,,,
"Напиток спиртной на основе рома Оакхарт Ориджинал Бакарди 0,5",2310,,900,,,,,,,,,1700,799,,,,,,,,,,
,,,,,,,,,,,,,,,,,,,,,,,
"РОМ 0,7л",новая цена,Наличие,New,,,,,,,,,цена,закуп,,,,,,,,,,
"Спиртной напиток ромовый КУЛ СКЕЛЕТОН КОКОС 37,5% 0,7Л",1890,"кб, бристоль",670,,,,,,,,,,,,,,,,,,,,
"Спиртной напиток ромовый КУЛ СКЕЛЕТОН МАНГО МАРАКУЙЯ 37,5% 0,7Л",1900,"кб, бристоль",670,,,,,,,,,,,,,,,,,,,,
"Ром Мама Джама Блэк выдержанный 0,7 л",1930,,690,,,,,,,,,1500,1100,,,,,,,,,,
"Ром Блэк Пирл Дарк\Уайт 0,7 л",2490,,1000,,,,,,,,,1900,1000,,,,,,,,,,
"Набор коктейль ОАКХАРТ ОРИДЖИНАЛ СПАЙСД ГОЛД С РОМОМ 35% П/УП. 0,7Л + RICH COLA 2ШТ
",2500,"бристоль,кб",1000,,,,,,,,,,,,,,,,,,,,
"Напиток спиртной на основе рома Оакхарт Ориджинал Бакарди 0,7",2850,,1200,,,,,,,,,1900,1000,,,,,,,,,,
"Ром выдержанный Сангсом в п/к 0,7 л",3020,,1300,,,,,,,,,2000,1300,,,,,,,,,,
"Ром невыдержанный ОЛД МОНК БЕЛЫЙ 42,8% 0,75Л",3210,бристоль,1400,,,,,,,,,,,,,,,,,,,,
"Ром выдержанный ОЛД МОНК 7 ЛЕТ 42,8% 0,75Л",3390,бристоль,1500,,,,,,,,,,,,,,,,,,,,
"Ром БАРСЕЛО АНЬЕХО ВЫДЕРЖАННЫЙ 37,5-40% ТЕМН. 0,7Л ",3480,,1550,,,,,,,,,2300,1300,,,,,,,,,,
"Напиток спиртной Капитан Морган Пряный Золотой  0,7 л",3920,,1800,,,,,,,,,2600,1800,,,,,,,,,,
"Ром выдержанный Гавана Клаб Аньехо 3 года белый 0,7 л",4390,,2060,,,,,,,,,3100,2000,,,,,,,,,,
"Ром Контрабандо 5 лет 0,7 л",4280,,2000,,,,,,,,,4499,2400,,,,,,,,,,
"Ром Бругал Аньехо Супериор 0,7 л",5180,,2500,,,,,,,,,3100,2500,,,,,,,,,,
"Ром ЗАКАПА СЭНТЭНАРИО СОЛЕРА ГРАН РЕЗЕРВА 23 ГОДА 40% П/УП. 0,7Л",13260,"очень мало, бристоль",7000,,,,,,,,,7800,7000,,,,,,,,,,
"Ром Закапа XO п/к 0,7 л",,,11000,,,,,,,,,12000,10500,,,,,,,,,,
"Ром выдержанный БАРСЕЛО ДОРАДО 37,5-40% 0,7Л",,нет,нет,,,,,,,,,2400,1500,,,,,,,,,,
"Ром КАПИТАН МОРГАН ТЕМН. 40% 0,7Л ",,нет,нет,,,,,,,,,3200,1800,,,,,,,,,,
,,,,,,,,,,,,,,,,,,,,,,,
ТЕКИЛА,новая цена,Наличие,New,,,,,,,,,цена,закуп,,,,,,,,,,
"Коктейль Альта Коста Сильвер с текилой 0,5 л",1510,,450,,,,,,,,,1500,400,,,,,,,,,,
"Текила ИНДИАНА СИЛЬВЕР 33-35% 0,7Л",3390,бристоль,1500,,,,,,,,,2100,1200,,,,,,,,,,
"Текила ИНДИАНА ГОЛД 35% 0,7Л",3390,бристоль,1500,,,,,,,,,2100,1200,,,,,,,,,,
"Текила Ранчо Вьехо Сильвер 0,7 л",3400,,1500,,,,,,,,,2600,1400,,,,,,,,,,
"Напиток спиртной текила Ольмека Белая 0,7 л",5010,,2400,,,,,,,,,3400,2400,,,,,,,,,,
"Текила Хосе Куэрво Эспесиаль Сильвер 0,7 л",5550,,2700,,,,,,,,,3200,1800,,,,,,,,,,
"Текила Хосе Куэрво Репосадо 0,7 л",5550,,2700,,,,,,,,,3300,2700,,,,,,,,,,
"Спиртной напиток ТЕКИЛА АСИЕНДА ВЬЕХА БЛАНКО 40% 0,75Л",6080,бристоль,3000,,,,,,,,,3900,2000,,,,,,,,,,
"Спиртной напиток ТЕКИЛА АСИЕНДА ВЬЕХА РЕПОСАДО 40% 0,75Л",6080,бристоль,3000,,,,,,,,,4000,2600,,,,,,,,,,
"Текила Эсполон Бланко 0,75 л",6100,,3000,,,,,,,,,4000,2590,,,,,,,,,,
"Текила Эсполон Аньехо 0,75 л",7880,,4000,,,,,,,,,,,,,,,,,,,,
"Текила Эсполон Репосадо 0,75 л",,,,,,,,,,,,,,,,,,,,,,,
"Текила САУЗА АСЬЕНДА ГОЛД 38% 0,7Л",,нет,нет,,,,,,,,,3000,2700,,,,,,,,,,
,,,,,,,,,,,,,,,,,,,,,,,
ДЖИН,новая цена,Наличие,New,,,,,,,,,цена,закуп,,,,,,,,,,
"Джин БРИСТОЛЛС 40% 0,5Л",1680,бристоль,550,,,,,,,,,1400,500,,,,,,,,,,
"Джин БРИСТОЛЛС 40% 0,7Л",2040,бристоль,750,,,,,,,,,1600,700,,,,,,,,,,
"Джин Гордонс лондонский сухой 0,7",4650,,2200,,,,,,,,,2800,1400,,,,,,,,,,
"Джин ПИКИ БЛАЙДЕР СПАЙС 0,7",,нет,нет,,,,,,,,,2000,900,,,,,,,,,,
"Джин Фримен Классик\Пинк 0,5 л",,нет,нет,,,,,,,,,1400,360,,,,,,,,,,
"Джин РОКУ 44% 0,7Л",,нет,нет,,,,,,,,,4600,3800,,,,,,,,,,
"Джин Битли Ботаникал\классик лондон драй\Слое 0,5 л        ",,нет,нет,,,,,,,,,1500,580,,,,,,,,,,
,,,,,,,,,,,,,,,,,,,,,,,
ЛИКЕР,новая цена,Наличие,New,,,,,,,,,цена,закуп,,,,,,,,,,
"Ликер десертный Сан Ламаджо ЛИМОНЧЕЛЛО 25% 0,5Л",1320,,350,,,,,,,,,1200,350,,,,,,,,,,
"Ликер Оранго Биттер 0,5 л",1590,,500,,,,,,,,,1100,500,,,,,,,,,,
"Ликер Ягодамастер Ботаникал 0,5 л",1720,,570,,,,,,,,,1100,570,,,,,,,,,,
"Ликер Старейшина Альпин Хани 0,5 л",2120,,800,,,,,,,,,1600,700,,,,,,,,,,
"Ликер Найт Габриелло Амаретто 0,5 л",1950,,700,,,,,,,,,1800,700,,,,,,,,,,
"Настойка Абсент Абсолвент горькая 0,5 л",3550,,1590,,,,,,,,,2700,1590,,,,,,,,,,
"Ликер десертный Ягермайстер 0,7",3750,,1700,,,,,,,,,2900,1600,,,,,,,,,,
"Напиток спирт. Апероль (аперитив) 0,7л",3920,,1800,,,,,,,,,2900,1500,,,,,,,,,,
"Ликер десертный Кампари (аперитив) 0,75 л",4280,,2000,,,,,,,,,2700,1650,,,,,,,,,,
"ЛАМОНИКА САМБУКА ЭКСТРА 42% 0,5Л",,нет,нет,,,,,,,,,1200,870,,,,,,,,,,
"Ликер Baron Roussac Irish Cream сливочный 0,5 л",,нет,нет,,,,,,,,,1100,550,,,,,,,,,,
"Ликер крепкий ЛОРЕНЦО ГАСПАРИНИ САМБУКА 40% 0,5Л",,нет,нет,,,,,,,,,1400,450,,,,,,,,,,
"Ликер Найт Габриэлло Лимончелло 0,5 л",,нет,нет,,,,,,,,,1800,780,,,,,,,,,,
,,,,,,,,,,,,,,,,,,,,,,,
"ПРОСЕККО, БРЮТ",новая цена,Наличие,New,страна,сорт винограда,крепость,,,,,,цена,закуп,,,,,,,,,,
"Вино игристое Российское Премиум белое брют 0,75 л",1120,,240,Россия,Белые сорта винограда,11,,,,,,1100,240,,,,,,,,,,
Вино игристое Шато Тамань РОЗОВОЕ брют 0.75,1320,,350,Россия,Пино Блан/Мюллер/Мускат/Саперави,"12,5",,,,,,1200,320,,,,,,,,,,
"Вино игристое Российское Фанагория белое брют 0,75 л",1590,,500,Россия,Шардоне/Алиготе/Пино Нуар/Рислинг,12,,,,,,1300,450,,,,,,,,,,
"Вино игристое ВёВ Албан белое брют 0,75 л",1860,,650,Франция,Айрен,11,,,,,,1600,550,,,,,,,,,,
"Вино игристое Вёв Албан розовое брют 0,75 л",1890,,670,Россия,Айрен,"11,5",,,,,,1600,600,,,,,,,,,,
"Вино игристое Проссимо спуманте белое брют 0,75 л",2080,,770,Италия,Гарганега,11,,,,,,1700,630,,,,,,,,,,
"Вино игристое Кава Арте Латино розовое брют 0,75 л",2120,,800,Испания,Трепат\Пино Нуар,"11,5",,,,,,1700,750,,,,,,,,,,
"Вино игристое Корте дей Рови Просекко Экстра Драй DOC белое сухое 0,75 л",2950,,1260,Италия,Глера/Просекко,11,,,,,,1900,1260,,,,,,,,,,
Вино игристое Мондро Брют бел.брют,3020,,1300,Италия,"Треббьяно, Шардоне","11,5",,,,,,2200,1200,,,,,,,,,,
"Вино игристое Креман де Луар Домен д`Аврийе белое брют 0,75 л",3100,,1300,Франция,Шардоне\Пино Нуар\Шенен Блан,11,,,,,,3000,1300,,,,,,,,,,
Игристое вино Просекко Мартини белое сухое,3560,,1600,Италия,Глера/Просекко,"11,5",,,,,,2100,1190,,,,,,,,,,
Вино игристое Мондоро Просекко защ.геогр.ук.бел.сух,4110,,1900,Италия,Глера/Просекко,11,,,,,,2300,1380,,,,,,,,,,
"Вино игристое Кюве ДиПи Традишн Давид Порэ белое брют 0,75 л",5180,,2500,Франция,Шардоне/Пино Нуар/Пино Менье,"12,5",,,,,,3900,2500,,,,,,,,,,
"Вино игристое Шампань Де Корветте Премье Крю белое брют 0,75 л",9130,,4700,Франция,Шардоне/Пино Нуар/Пино Менье,"12,5",,,,,,7000,4700,,,,,,,,,,
"Вино игристое выдержанное Моэт и Шандон Империаль белое брют 0,75 л",12800,,6740,Франция,Шардоне/Пино Нуар/Пино Менье,12,,,,,,9500,5900,,,,,,,,,,
"Вино игристое выдержанное Дж.Г. Мумм Гранд Кордон Брют белое п/к 0,75 л",,нет,нет,Франция,Шардоне/Пино Нуар/Пино Менье,12,,,,,,4200,2890,,,,,,,,,,
"Вино игристое Вальпьяна Миллезимато Экстра Драй белое брют 0,75 л",,нет,нет,Италия,Глера,11,,,,,,1600,400,,,,,,,,,,
,,,,,,,,,,,,,,,,,,,,,,,
АСТИ,новая цена,Наличие,New,страна,сорт винограда,крепость,,,,,,цена,закуп,,,,,,,,,,
"Вино игристое Российское Премиум белое полусладкое 0,75 л",1120,,240,Россия,Белые сорта винограда,12,,,,,,1100,240,,,,,,,,,,
"Вино игристое Массимо Висконти Ламбруско белое сладкое 0,75 л",1750,,590,Италия,Ламбруско,"7,5",,,,,,1500,500,,,,,,,,,,
"Вино игристое Исси Мальвазия Спуманте белое сладкое 0,75 л",2390,,950,Италия,Мальвазия/Мускат,7,,,,,,1800,900,,,,,,,,,,
"Вино игристое Атто Примо Асти белое сладкое 0,75 л",2480,,990,Италия,Мускат,"7,5",,,,,,1900,990,,,,,,,,,,
Вино игристое Сант Орсола Асти DOCG белое сладкое,2490,,1000,Италия,Мускат,7,,,,,,1800,880,,,,,,,,,,
Игристое вино Мартини Асти Пьемонт бел.сл,3020,,1300,Италия,Мускат,"7,5",,,,,,2100,1290,,,,,,,,,,
Вино игристое Чинзано Асти DOCG бел.сл,3390,,1500,Италия,Мускат,7,,,,,,2000,1190,,,,,,,,,,
Вино игристое Мондоро Асти DOCG бел.сл,4110,,1900,Италия,Мускат,"7,5",,,,,,2300,1470,,,,,,,,,,
Напиток винный газ. Ламбруско Розато п/сл 0.75,,нет,нет,Россия,,8,,,,,,1000,200,,,,,,,,,,
Напиток винный газ. Ламбруско Бьянко п/сл 0.75,,нет,нет,Россия,,8,,,,,,1000,250,,,,,,,,,,
"Вино игристое Советское Шампанское белое полусладкое 0,75 л",,нет,нет,Россия,Шардоне/Совиньон Блан/Алиготе/Рислинг/Кокур,11,,,,,,1100,280,,,,,,,,,,
"Вино игристое Фальдео Асти DOCG белое сладкое 0,75 л",,нет,нет,Италия,Мускат,7,,,,,,1700,нет в наличии,,,,,,,,,,
,,,,,,,,,,,,,,,,,,,,,,,
ВЕРМУТ,новая цена,Наличие,New,,,,,,,,,цена,закуп,,,,,,,,,,
Плодовый алкогольный Вермут Чеароквонти Бьянко 1 л,1460,,430,,,,,,,,,1000,330,,,,,,,,,,
"Вермут Каза Позитано Бьянко белый сладкий 0,75 л",2040,очень мало,750,,,,,,,,,1400,750,,,,,,,,,,
"Вермут Мартини Бьянко белый сладкий 0,5 л",2390,,950,,,,,,,,,1600,950,,,,,,,,,,
"Вермут Мартини Бьянко белый сладкий 0,75 л",2670,,1100,,,,,,,,,1900,1000,,,,,,,,,,
"Вермут Мартини Фиеро сладкий 0,75 л",2700,,1100,,,,,,,,,1900,1100,,,,,,,,,,
"Вермут Мартини Экстра Драй белый сухой 0,75 л",2750,,1150,,,,,,,,,1900,1150,,,,,,,,,,
Вермут ЧИНЗАНО БЬЯНКО 15% БЕЛ. СЛ. 1Л ,3210,бристоль,1400,,,,,,,,,2000,1200,,,,,,,,,,
,,,,,,,,,,,,,,,,,,,,,,,
ПИВО,новая цена,Наличие,New,,,,,,,,,цена,закуп,,,,,,,,,,
"пиво Рижское светлое ст 0,45 л",189,,55,,,,,,,,,,,,,,,,,,,,
жигулевское,199,,50,,,,,,,,,150,50,,,,,,,,,,
"Пиво Жигули Барное светлое ст 0,31 л",179,,53,,,,,,,,,,,,,,,,,,,,
"Пиво БАЛТИКА КЛАССИЧЕСКОЕ №3 СВЕТЛ. ФИЛЬТР. ПАСТЕР. СТ/Б 0,5Л",199,,64,,,,,,,,,,,,,,,,,,,,
"Сидр Мистер Лис Яблоко ж/б 0,43 л",199,,64,,,,,,,,,,,,,,,,,,,,
"Пиво Белорусское светлое фильтрованное пастеризованное ст 0,5 л",209,,67,,,,,,,,,,,,,,,,,,,,
"Пиво LOWENBRAU ОРИГИНАЛЬНОЕ СВЕТЛ. ФИЛЬТР. ПАСТЕР. Ж/Б 0,45Л",219,,68,,,,,,,,,,,,,,,,,,,,
"Пиво СТАРЫЙ МЕЛЬНИК ИЗ БОЧОНКА МЯГКОЕ СВЕТЛ. ФИЛЬТР. ПАСТЕР. СТ/Б 0,45Л",219,,70,,,,,,,,,,,,,,,,,,,,
"Пивной напиток СТАРЫЙ МЕЛЬНИК ИЗ БОЧОНКА БАРХАТНОЕ ТЕМН. ФИЛЬТР. ПАСТЕР. СТ/Б 0,45Л",219,,70,,,,,,,,,,,,,,,,,,,,
"Пиво КРУШОВИЦЕ СВЕТЛ. ФИЛЬТР. ПАСТЕР. Ж/Б 0,43Л",219,,70,,,,,,,,,,,,,,,,,,,,
Козел светлое/темное,239,,80,,,,,,,,,200,80,,,,,,,,,,
"Сидр Бон Сезон ст 0,4 л",239,,90,,,,,,,,,,,,,,,,,,,,
"Пивной напиток KRONE BLANCHE BIERE СВЕТЛ. НЕФИЛЬТР. ПАСТЕР. СТ/Б 0,45Л",239,,90,,,,,,,,,,,,,,,,,,,,
"Эсса(Дыня-клубника,Кокос-манго,Ананас-грейпфрут)",249,,70,,,,,,,,,250,70,,,,,,,,,,
Хугарден,259,,89,,,,,,,,,250,89,,,,,,,,,,
"Пиво Fiery Shield светлое фильтрованное ст 0,33 л (АНАЛОГ КОРОНЫ)",269,,95,,,,,,,,,200,95,,,,,,,,,,
шпатен,299,,115,,,,,,,,,300,115,,,,,,,,,,
корона ,349,(перекресток/лента/кб),130,,,,,,,,,350,130,,,,,,,,,,
Пиво Bud 0.5 л (стяжка 4шт),999,,370,,,,,,,,,799,75,,,,,,,,,,
"Пиво Стелла Артуа светлое ст 0,44 л (стяжка 4шт)",1199,(Кб/лента/бристоль) ,430,,,,,,,,,1199,80,,,,,,,,,,
"Пиво Хопфендорф Шварцбир темное ж/б 0,5 л",нет,нет,80,,,,,,,,,200,80,,,,,,,,,,
"Пиво Хопфендорф Шварцбир темное фильтрованное пастеризованное ж/б 0,5 л",нет,нет,80,,,,,,,,,200,80,,,,,,,,,,
"Пиво Белджиан Крон Лагер светлое ж/б 0,5 л",нет,нет,80,,,,,,,,,250,80,,,,,,,,,,
"Пиво Хоп Райдер Уит Пэйл Эль светлое ж/б 0,33 л",нет,нет,80,,,,,,,,,150,80,,,,,,,,,,
"Пиво Хоп Райдер Экстра Стаут темное ж/б 0,33 л",нет,нет,80,,,,,,,,,150,80,,,,,,,,,,
"Пиво Евротур Шварц темное фильтрованное пастеризованное ж/б 0,5 л",нет,нет,80,,,,,,,,,200,80,,,,,,,,,,
чешское,нет,нет,70,,,,,,,,,200,70,,,,,,,,,,
,,,,,,,,,,,,,,,,,,,,,,,
ПИВО 1л и больше,новая цена,Наличие,New,,,,,,,,,цена,закуп,,,,,,,,,,
"Пиво ЖИГУЛЕВСКОЕ ТРАДИЦИОННОЕСВЕТЛ. ФИЛЬТР. 1,2Л",299,,110,,,,,,,,,250,,,,,,,,,,,
"Пиво СТАРЫЙ МЕЛЬНИК ИЗ БОЧОНКА МЯГКОЕ СВ.ФИ. 0,9л",299,,109,,,,,,,,,250,,,,,,,,,,,
"Пиво Рижское светлое ПЭТ 1,3 л",359,,120,,,,,,,,,200,,,,,,,,,,,
Разливное светлое фильтрованное 1л,399,,120,,,,,,,,,400,120,,,,,,,,,,
Разливное светлое нефильтрованное 1л,399,,120,,,,,,,,,400,120,,,,,,,,,,
"Пиво БЕЛЫЙ МЕДВЕДЬ СВЕТЛ. ФИЛЬТР. ПАСТЕР. ПЭТ 1,15Л",419,,140,,,,,,,,,300,,,,,,,,,,,
"Пиво CARLSBERG СВЕТЛ. ФИЛЬТР. ПАСТЕР. ПЭТ 1,35Л",449,,150,,,,,,,,,300,,,,,,,,,,,
Разливое темное 1л,449,,130,,,,,,,,,450,130,,,,,,,,,,
"Пиво Австрийское светлое ПЭТ 1,5 л",459,,150,,,,,,,,,300,,,,,,,,,,,
"Пиво Живая Варка светлое ПЭТ 1,5 л",469,,150,,,,,,,,,300,,,,,,,,,,,
"Пиво Пшеничное мягкое ПЭТ 1,5 л",479,,150,,,,,,,,,300,,,,,,,,,,,
"Пиво TUBORG GREEN СВЕТЛ. ФИЛЬТР. ПАСТЕР. ПЭТ 1,35Л",499,,170,,,,,,,,,350,,,,,,,,,,,
"Пиво ГЁССЕР СВЕТЛ. ФИЛЬТР. ПАСТЕР. ПЭТ 1,2Л",539,,180,,,,,,,,,300,,,,,,,,,,,
"Пиво Nord Land Beer светлое крепкое фильтрованное 1,2 л",,нет,нет,,,,,,,,,250,,,,,,,,,,,
,,,,,,,,,,,,,,,,,,,,,,,
НАПИТКИ Б\А,новая цена,наличие,закуп,,,,,,,,,,,,,,,,,,,,
Вода Аква Минерале газированная 2 л,169,,70,,,,,,,,,,,,,,,,,,,,
Вода Аква Минерале негаз 2 л,169,,70,,,,,,,,,,,,,,,,,,,,
"Минеральная вода Заветный родник негазированная 1,5 л",149,,50,,,,,,,,,,,,,,,,,,,,
"Вода Аква Люкс газ 1,5 л",149,,50,,,,,,,,,,,,,,,,,,,,
Вода минеральная Аш Тау Скважина 6К газированная 1 л,99,,35,,,,,,,,,,,,,,,,,,,,
Напиток ДОБРЫЙ КОЛА ГАЗ.  1Л,299,,100,,,,,,,,,,,,,,,,,,,,
Сок RICH ВИШНЯ 1Л,389,,180,,,,,,,,,,,,,,,,,,,,
Сок RICH ТОМАТ 1Л,349,,160,,,,,,,,,,,,,,,,,,,,
Сок RICH АПЕЛЬСИН\АНАНАС\ГРЕЙПФРУТ 1Л,399,,190,,,,,,,,,,,,,,,,,,,,
Сок Сады Придонья томатный с солью с мякотью\яблоко 1 л,339,,150,,,,,,,,,,,,,,,,,,,,
"Напиток НАТАХТАРИ ГРУША\ФЕЙХОА\САПЕРАВИ СТ/Б 0,5Л",299,,108,,,,,,,,,,,,,,,,,,,,
"Напиток LIPTON ЗЕЛЕНЫЙ ЧАЙ\ЧЕРНЫЙ ЛИМОН НЕГАЗ. 0,5л",249,,90,,,,,,,,,,,,,,,,,,,,
Напиток Рич индиан тоник\биттер лимон сильногазированный 1 л,319,,135,,,,,,,,,,,,,,,,,,,,
Газированный напиток Эвервесс Биттер Лимон 1 л,239,,80,,,,,,,,,,,,,,,,,,,,
"Газированный напиток Старые Добрые Традиции Лимонад ст 0,5 л",159,,40,,,,,,,,,,,,,,,,,,,,
"Квас Добрый хлеб фильтрованный пастеризованный 1,5 л",169,,50,,,,,,,,,,,,,,,,,,,,
"Чай IceTea Лимон\лесные ягоды\малина 0,5 л",139,,50,,,,,,,,,,,,,,,,,,,,
"Минеральная вода Ессентуки Целебная газированная ст 0,5 л",129,,40,,,,,,,,,,,,,,,,,,,,
"Нектар Сады Придонья мультифрутовый\яблоко\черешня 0,95 л",399,,209,,,,,,,,,,,,,,,,,,,,
Газированный напиток Экспорт Стаил Классик Кола 2 л,299,,100,,,,,,,,,,,,,,,,,,,,
,,,,,,,,,,,,,,,,,,,,,,,
СИГАРЕТЫ И СТИКИ (за пачку),новая цена,Наличие,New,,,,,,,,,цена,закуп,,,,,,,,,,
Сигареты LUCKY STRIKE Green,399,,159,,,,,,,,,350,159,,,,,,,,,,
Сигареты Ротманс Грин,399,,159,,,,,,,,,350,159,,,,,,,,,,
Сигареты Ротманс Дэми Классик,419,,170,,,,,,,,,350,170,,,,,,,,,,
Сигареты Камелл Желтый,449,,180,,,,,,,,,400,180,,,,,,,,,,
Сигареты Камелл Компакт,449,,180,,,,,,,,,350,180,,,,,,,,,,
Стики NEO Ванилла\Тобакко\Тропик,469,,190,,,,,,,,,450,190,,,,,,,,,,
Сигареты LUCKY STRIKE XL,469,,190,,,,,,,,,350,190,,,,,,,,,,
Стики IQOS Heets Янтарные\Бронзовые\Голд\Грин\Фиол.\Слайт\Самер Бриз,499,,200,,,,,,,,,450,200,,,,,,,,,,
Сигареты Винстон Вайт,499,,200,,,,,,,,,400,200,,,,,,,,,,
Сигареты Винстон ИксСтайл,499,,202,,,,,,,,,400,202,,,,,,,,,,
Сигареты Винстон xs blue Тонкие,509,,223,,,,,,,,,450,223,,,,,,,,,,
Сигареты Парламент Платинум Блю,539,,230,,,,,,,,,450,230,,,,,,,,,,
Сигареты Винстон XS компакт блю,539,,230,,,,,,,,,400,230,,,,,,,,,,
Сигареты Винстон Рэд,539,,230,,,,,,,,,450,230,,,,,,,,,,
Сигареты Винстон Блю,539,,230,,,,,,,,,400,230,,,,,,,,,,
Сигареты Винстон Сильвер,549,,233,,,,,,,,,400,233,,,,,,,,,,
Сигареты Винстон Классик,559,,240,,,,,,,,,400,240,,,,,,,,,,
Сигареты Парламент аква блю,619,,279,,,,,,,,,500,279,,,,,,,,,,
Сигареты Парламент сильвер блю,629,,279,,,,,,,,,500,279,,,,,,,,,,
Сигареты Парламент One,639,,279,,,,,,,,,500,279,,,,,,,,,,
,,,,,,,,,,,,,,,,,,,,,,,
ЭЛЕКТРОНКИ,новая цена,Наличие,New,,,,,,,,,цена,закуп,,,,,,,,,,
бристоль или любой продуктовый/вейпшоп,,,,,,,,,,,,,,,,,,,,,,,
Электронная одноразовая система от 2000тяг,3599,,1900,,,,,,,,,1990,,,,,,,,,,,
"(дыня, кола, банан, ягодный микс, клубничный коктейль,",,,,,,,,,,,,,,,,,,,,,,,
"гуава-маракуйа, малина-арбуз, яблоко, мармелад, манго",,,,,,,,,,,,,,,,,,,,,,,
Электронная одноразовая система от 5000тяг,4199,,2500,,,,,,,,,2900,,,,,,,,,,,
"(банан, ягодный микс, клубника,маракуйа,яблоко,манго)",,,,,,,,,,,,,,,,,,,,,,,
,,,,,,,,,,,,,,,,,,,,,,,
СНЭКИ И ДР,новая цена,Наличие,New,,,,,,,,,цена,закуп,,,,,,,,,,
ЛУКОВЫЕ КОЛЬЦА СМЕТАНА\СЫР 45г,109,,40,,,,,,,,,100,,,,,,,,,,,
